{"version": 1, "veranlagungszeitraum": 2025, "events": [{"event_id": "0cd50bd884fa891f641d0703ce6e7fc3fe89bbc65de5800601a78d9df20076d3", "ts": "2026-01-15T09:00:00+00:00", "feld_id": "vv_einnahmen", "wert": 0, "zustand": "bestaetigt", "herkunft": {"herkunft": "laie", "pruef_tiefe": "ungeprueft", "haftung": "nutzer"}, "schreiber": "ui:laie", "signal": {"signal_1": null, "signal_2": "ok@vv_einnahmen"}, "ersetzt": null}, {"event_id": "a68f8416a11cf373a7c2c80476e87184b816b0a3e35455b095a8d8af6a532e7b", "ts": "2026-01-15T09:00:01+00:00", "feld_id": "vv_gebaeude_afa", "wert": 0, "zustand": "bestaetigt", "herkunft": {"herkunft": "laie", "pruef_tiefe": "ungeprueft", "haftung": "nutzer"}, "schreiber": "ui:laie", "signal": {"signal_1": null, "signal_2": "ok@vv_gebaeude_afa"}, "ersetzt": null}, {"event_id": "1b3db6fdc2e13b615e038d823395544b7a9331391fe6744c7a8a7dfba75c6278", "ts": "2026-01-15T09:00:02+00:00", "feld_id": "vv_schuldzinsen", "wert": 0, "zustand": "bestaetigt", "herkunft": {"herkunft": "laie", "pruef_tiefe": "ungeprueft", "haftung": "nutzer"}, "schreiber": "ui:laie", "signal": {"signal_1": null, "signal_2": "ok@vv_schuldzinsen"}, "ersetzt": null}, {"event_id": "b584174bf369a03bb903ec2b526ef43c6a1f86d900ca38fc55a4407b105e12c4", "ts": "2026-01-15T09:00:03+00:00", "feld_id": "vv_erhaltungsaufwand", "wert": 0, "zustand": "bestaetigt", "herkunft": {"herkunft": "laie", "pruef_tiefe": "ungeprueft", "haftung": "nutzer"}, "schreiber": "ui:laie", "signal": {"signal_1": null, "signal_2": "ok@vv_erhaltungsaufwand"}, "ersetzt": null}, {"event_id": "63ba357782f90726d74c781e9fb0d2d24a54a9db6a379ebb2c1906f7e52df829", "ts": "2026-01-15T09:00:04+00:00", "feld_id": "vv_sonstige_wk", "wert": 0, "zustand": "bestaetigt", "herkunft": {"herkunft": "laie", "pruef_tiefe": "ungeprueft", "haftung": "nutzer"}, "schreiber": "ui:laie", "signal": {"signal_1": null, "signal_2": "ok@vv_sonstige_wk"}, "ersetzt": null}, {"event_id": "5ed7b419f973d21c112d0068af1ec6cb88f384719ae4c44845478822900f3eb3", "ts": "2026-01-15T09:00:05+00:00", "feld_id": "vv_entgelt_quote_prozent", "wert": 0, "zustand": "bestaetigt", "herkunft": {"herkunft": "laie", "pruef_tiefe": "ungeprueft", "haftung": "nutzer"}, "schreiber": "ui:laie", "signal": {"signal_1": null, "signal_2": "ok@vv_entgelt_quote_prozent"}, "ersetzt": null}, {"event_id": "8b31496f92ce7f21aae11b87697ac9c3c38b5773ea511ccf117fe9f59f203bc3", "ts": "2026-01-15T09:00:06+00:00", "feld_id": "veranlagung", "wert": "einzel", "zustand": "bestaetigt", "herkunft": {"herkunft": "laie", "pruef_tiefe": "ungeprueft", "haftung": "nutzer"}, "schreiber": "ui:laie", "signal": {"signal_1": null, "signal_2": "ok@veranlagung"}, "ersetzt": null}, {"event_id": "914925cc4259def545324bd8305a024156b7277ab9b736a49acd857ae1db24e2", "ts": "2026-01-15T09:00:07+00:00", "feld_id": "bruttoarbeitslohn", "wert": 4850000, "zustand": "bestaetigt", "herkunft": {"herkunft": "laie", "pruef_tiefe": "ungeprueft", "haftung": "nutzer"}, "schreiber": "ui:laie", "signal": {"signal_1": null, "signal_2": "ok@bruttoarbeitslohn"}, "ersetzt": null}, {"event_id": "503b29365329211b249de6772e13d0d447835b6ec0d4fa1b38e722274ec9aef0", "ts": "2026-01-15T09:00:08+00:00", "feld_id": "ep_arbeitstage", "wert": 0, "zustand": "bestaetigt", "herkunft": {"herkunft": "laie", "pruef_tiefe": "ungeprueft", "haftung": "nutzer"}, "schreiber": "ui:laie", "signal": {"signal_1": null, "signal_2": "ok@ep_arbeitstage"}, "ersetzt": null}, {"event_id": "749b520749384b3f80968e997424e6c4077c6519a211010a47040e58cafea956", "ts": "2026-01-15T09:00:09+00:00", "feld_id": "ep_entfernung_km", "wert": 0, "zustand": "bestaetigt", "herkunft": {"herkunft": "laie", "pruef_tiefe": "ungeprueft", "haftung": "nutzer"}, "schreiber": "ui:laie", "signal": {"signal_1": null, "signal_2": "ok@ep_entfernung_km"}, "ersetzt": null}, {"event_id": "e57e917ea8fb09098713c5d9ab92aba34b19c35b48704ee5542391fee7d5f8f8", "ts": "2026-01-15T09:00:10+00:00", "feld_id": "ep_oepnv_kosten", "wert": 0, "zustand": "bestaetigt", "herkunft": {"herkunft": "laie", "pruef_tiefe": "ungeprueft", "haftung": "nutzer"}, "schreiber": "ui:laie", "signal": {"signal_1": null, "signal_2": "ok@ep_oepnv_kosten"}, "ersetzt": null}, {"event_id": "a5fbf257194a2bca1f5a9527c2a2e0287449b5cb71d6d09bbd4854ec13cebf75", "ts": "2026-01-15T09:00:11+00:00", "feld_id": "ep_eigenes_kfz", "wert": false, "zustand": "bestaetigt", "herkunft": {"herkunft": "laie", "pruef_tiefe": "ungeprueft", "haftung": "nutzer"}, "schreiber": "ui:laie", "signal": {"signal_1": null, "signal_2": "ok@ep_eigenes_kfz"}, "ersetzt": null}, {"event_id": "1cd0b61a894a68578271639c766e3161bfa8952ec0d8c8357bb10ae4e5f5f1f5", "ts": "2026-01-15T09:00:12+00:00", "feld_id": "vor_an_anteil_rv", "wert": 451050, "zustand": "bestaetigt", "herkunft": {"herkunft": "laie", "pruef_tiefe": "ungeprueft", "haftung": "nutzer"}, "schreiber": "ui:laie", "signal": {"signal_1": null, "signal_2": "ok@vor_an_anteil_rv"}, "ersetzt": null}, {"event_id": "464628e2ed97aa42aacaa580a9bb09e189e04ba0515858b4058830722111cc14", "ts": "2026-01-15T09:00:13+00:00", "feld_id": "vor_ag_anteil_rv", "wert": 451050, "zustand": "bestaetigt", "herkunft": {"herkunft": "laie", "pruef_tiefe": "ungeprueft", "haftung": "nutzer"}, "schreiber": "ui:laie", "signal": {"signal_1": null, "signal_2": "ok@vor_ag_anteil_rv"}, "ersetzt": null}, {"event_id": "71fe2b29cb9f3043e4c09e549291911dcf1a0925501579641b70d0ff07037f87", "ts": "2026-01-15T09:00:14+00:00", "feld_id": "vor_rv_ausserhalb_lstb", "wert": 0, "zustand": "bestaetigt", "herkunft": {"herkunft": "laie", "pruef_tiefe": "ungeprueft", "haftung": "nutzer"}, "schreiber": "ui:laie", "signal": {"signal_1": null, "signal_2": "ok@vor_rv_ausserhalb_lstb"}, "ersetzt": null}, {"event_id": "e9b09567273a9454d15ccd30a6a85369c007d3937e1bee83a4e92e8719d6da3c", "ts": "2026-01-15T09:00:15+00:00", "feld_id": "versicherungsart", "wert": "gesetzlich_an", "zustand": "bestaetigt", "herkunft": {"herkunft": "laie", "pruef_tiefe": "ungeprueft", "haftung": "nutzer"}, "schreiber": "ui:laie", "signal": {"signal_1": null, "signal_2": "ok@versicherungsart"}, "ersetzt": null}, {"event_id": "085295c1774f453dbe6d6bea865af4f8d838cbd18a9d91bfec014b4e945bccb3", "ts": "2026-01-15T09:00:16+00:00", "feld_id": "basis_kv", "wert": 0, "zustand": "bestaetigt", "herkunft": {"herkunft": "laie", "pruef_tiefe": "ungeprueft", "haftung": "nutzer"}, "schreiber": "ui:laie", "signal": {"signal_1": null, "signal_2": "ok@basis_kv"}, "ersetzt": null}, {"event_id": "3dd085f620a8092b74795157be79ac4dc2fab9952f4277ca1ac946997e531a29", "ts": "2026-01-15T09:00:17+00:00", "feld_id": "basis_pv", "wert": 0, "zustand": "bestaetigt", "herkunft": {"herkunft": "laie", "pruef_tiefe": "ungeprueft", "haftung": "nutzer"}, "schreiber": "ui:laie", "signal": {"signal_1": null, "signal_2": "ok@basis_pv"}, "ersetzt": null}, {"event_id": "ec40f273f53ae4381032cf0c2c9f56ad94512bf579bc8f9c0b2afc3edf3bdeee", "ts": "2026-01-15T09:00:18+00:00", "feld_id": "vorsorge_arbeitslosenversicherung", "wert": 0, "zustand": "bestaetigt", "herkunft": {"herkunft": "laie", "pruef_tiefe": "ungeprueft", "haftung": "nutzer"}, "schreiber": "ui:laie", "signal": {"signal_1": null, "signal_2": "ok@vorsorge_arbeitslosenversicherung"}, "ersetzt": null}, {"event_id": "58ff72d1b52b6c6ea3a0e95e03157f3d5f2a63055a769331bb2f3c1f2f78a5bf", "ts": "2026-01-15T09:00:19+00:00", "feld_id": "vorsorge_erwerbsunfaehigkeit", "wert": 0, "zustand": "bestaetigt", "herkunft": {"herkunft": "laie", "pruef_tiefe": "ungeprueft", "haftung": "nutzer"}, "schreiber": "ui:laie", "signal": {"signal_1": null, "signal_2": "ok@vorsorge_erwerbsunfaehigkeit"}, "ersetzt": null}, {"event_id": "deb02522fcf3557b494be91c26b29368ece23fa928cedfe99e919c1bf316cb7f", "ts": "2026-01-15T09:00:20+00:00", "feld_id": "vorsorge_unfall_haftpflicht", "wert": 0, "zustand": "bestaetigt", "herkunft": {"herkunft": "laie", "pruef_tiefe": "ungeprueft", "haftung": "nutzer"}, "schreiber": "ui:laie", "signal": {"signal_1": null, "signal_2": "ok@vorsorge_unfall_haftpflicht"}, "ersetzt": null}, {"event_id": "a747ec67905ab49c2b670b5f006a14737c7208411d42c82351e75346fd1ce049", "ts": "2026-01-15T09:00:21+00:00", "feld_id": "vorsorge_rv_alt_mit_ueberschuss", "wert": 0, "zustand": "bestaetigt", "herkunft": {"herkunft": "laie", "pruef_tiefe": "ungeprueft", "haftung": "nutzer"}, "schreiber": "ui:laie", "signal": {"signal_1": null, "signal_2": "ok@vorsorge_rv_alt_mit_ueberschuss"}, "ersetzt": null}, {"event_id": "1824c95990bf30d7cc5c6657e75f00974437a29d05c77983ea9d1f3b95d5a947", "ts": "2026-01-15T09:00:22+00:00", "feld_id": "vorsorge_rv_alt_ohne_ueberschuss", "wert": 0, "zustand": "bestaetigt", "herkunft": {"herkunft": "laie", "pruef_tiefe": "ungeprueft", "haftung": "nutzer"}, "schreiber": "ui:laie", "signal": {"signal_1": null, "signal_2": "ok@vorsorge_rv_alt_ohne_ueberschuss"}, "ersetzt": null}, {"event_id": "420ff4f0f53482553ac5c70435a318c4775a038df83d0c394f344b18a62ffb17", "ts": "2026-01-15T09:00:23+00:00", "feld_id": "mit_anspruch_auf_zuschuss", "wert": false, "zustand": "bestaetigt", "herkunft": {"herkunft": "laie", "pruef_tiefe": "ungeprueft", "haftung": "nutzer"}, "schreiber": "ui:laie", "signal": {"signal_1": null, "signal_2": "ok@mit_anspruch_auf_zuschuss"}, "ersetzt": null}, {"event_id": "a12ed7ac42548f612d77c482a37a7aa8c0401780a6ac5289488913423dc40c8c", "ts": "2026-01-15T09:00:24+00:00", "feld_id": "kap_kapitalertraege", "wert": 0, "zustand": "bestaetigt", "herkunft": {"herkunft": "laie", "pruef_tiefe": "ungeprueft", "haftung": "nutzer"}, "schreiber": "ui:laie", "signal": {"signal_1": null, "signal_2": "ok@kap_kapitalertraege"}, "ersetzt": null}, {"event_id": "3dae5f7a3851ac221572be9ccbcb75ac710ccc588e4b1004f757cd62d26fe8c6", "ts": "2026-01-15T09:00:25+00:00", "feld_id": "kap_gewinn_aktien", "wert": 0, "zustand": "bestaetigt", "herkunft": {"herkunft": "laie", "pruef_tiefe": "ungeprueft", "haftung": "nutzer"}, "schreiber": "ui:laie", "signal": {"signal_1": null, "signal_2": "ok@kap_gewinn_aktien"}, "ersetzt": null}, {"event_id": "351edb37e97fc8ea8197fd5